{
  "eventId": "evt_ordershipmentregistered_001",
  "eventType": "OrderShipmentRegistered",
  "schemaVersion": 1,
  "occurredAt": "2026-08-10T02:00:00Z",
  "publishedAt": "2026-08-10T02:00:01Z",
  "producer": "SYS-02",
  "environment": "DEV",
  "audience": [
    "SYS-03",
    "SYS-06"
  ],
  "enterpriseId": null,
  "aggregateType": "Order",
  "aggregateId": "ord_contract_001",
  "aggregateVersion": 3,
  "traceId": "trace_contract_fixture_001",
  "causationId": null,
  "correlationId": "corr_contract_fixture_001",
  "idempotencyKey": "SHIPMENT_REGISTER:ful_contract_001:1",
  "payload": {
    "commandId": "cmd_shipment_register_001",
    "fulfillmentId": "ful_contract_001",
    "orderId": "ord_contract_001",
    "subOrderId": "subord_contract_001",
    "sellerEnterpriseId": "ent_contract_001",
    "storeId": "store_contract_001",
    "carrierCode": "SF",
    "trackingNoMasked": "SF****1234",
    "shippedAt": "2026-08-10T02:00:00Z",
    "fulfillmentVersion": 1,
    "orderVersion": 3,
    "registeredAt": "2026-08-10T02:00:01Z"
  }
}
